<?xml version="1.0" encoding="UTF-8"?>

<requests xmlns="http://www.txazo.com/schema/weixin"
          xmlns:xsi="http://www.w3.org/2001/XMLSchema-instance"
          xsi:schemaLocation="http://www.txazo.com/schema/weixin http://www.txazo.com/schema/weixin/weixin-requests-1.0.xsd">

    <!-- 建立连接 -->
    <!-- 主动调用 -->
    <request uri="/cgi-bin/gettoken" contentType="DEFAULT" requireParams="corpid,corpsecret"/>
    <!-- 回调模式 -->
    <request uri="/cgi-bin/getcallbackip" contentType="DEFAULT" requireParams="access_token"/>

    <!-- 管理通讯录 -->
    <!-- 成员关注企业号 -->
    <request uri="/cgi-bin/user/authsucc" contentType="DEFAULT" requireParams="access_token,userid"/>
    <!-- 管理部门 -->
    <request uri="/cgi-bin/department/create" contentType="JSON" requireParams="access_token"/>
    <request uri="/cgi-bin/department/update" contentType="JSON" requireParams="access_token"/>
    <request uri="/cgi-bin/department/delete" contentType="DEFAULT" requireParams="access_token,id"/>
    <request uri="/cgi-bin/department/list" contentType="DEFAULT" requireParams="access_token,id"/>
    <!-- 管理成员 -->
    <!-- 管理标签 -->
    <!-- 异步任务接口 -->

    <!-- 管理多媒体文件 -->
    <!-- 上传媒体文件 -->
    <request uri="/cgi-bin/media/upload" contentType="STREAM" requireParams="access_token,type,media"/>
    <!-- 获取媒体文件 -->
    <request uri="/cgi-bin/media/get" contentType="DEFAULT" requireParams="access_token,media_id"/>

    <!-- 管理企业号应用 -->
    <!-- 获取企业号应用 -->
    <request uri="/cgi-bin/agent/get" contentType="DEFAULT" requireParams="access_token,agentid"/>
    <!-- 设置企业号应用 -->
    <request uri="/cgi-bin/agent/set" contentType="JSON" requireParams="access_token"/>
    <!-- 获取应用概况列表 -->
    <request uri="/cgi-bin/agent/list" contentType="DEFAULT" requireParams="access_token"/>

    <!-- 接收消息与事件 -->

    <!-- 发送消息 -->

    <!-- 自定义菜单 -->
    <!-- 创建应用菜单 -->
    <request uri="/cgi-bin/menu/create" contentType="JSON" requireParams="access_token,agentid"/>
    <!-- 删除菜单 -->
    <request uri="/cgi-bin/menu/delete" contentType="DEFAULT" requireParams="access_token,agentid"/>
    <!-- 获取菜单列表 -->
    <request uri="/cgi-bin/menu/get" contentType="DEFAULT" requireParams="access_token,agentid"/>

    <!-- OAuth2验证接口 -->
    <!-- 企业获取code -->
    <request uri="/connect/oauth2/authorize" contentType="DEFAULT"
             requireParams="appid,redirect_uri,response_type,scope"
             domain="https://qyapi.weixin.qq.com"/>
    <!-- 根据code获取成员信息 -->
    <request uri="/cgi-bin/menu/get" contentType="DEFAULT" requireParams="access_token,agentid"/>

    <!-- 微信JS接口 -->

    <!-- 第三方应用授权 -->

    <!-- 企业号登录授权 -->

</requests>